{
  "schema": 1,
  "accepted": true,
  "failures": [],
  "evidenceAt": "2026-08-20T12:16:18.337Z",
  "commitOrderVerified": true,
  "p2A11": {
    "accepted": true,
    "fileName": "p2-06-resource-soak.json",
    "sha256": "52af476de4ea7e06d5e58223338b7f8cba8df5cdbf36193dfad008d1878a50fd",
    "gitCommit": "c0508c66ec6905decc1e70cc328e585a887fb6c5",
    "startedAt": "2026-08-20T04:16:01.018Z",
    "completedAt": "2026-08-20T12:16:18.337Z",
    "durationSeconds": 28800,
    "fixtureCount": 100000,
    "environment": {
      "platform": "darwin",
      "architecture": "arm64",
      "nodeVersion": "v24.19.0"
    },
    "summary": {
      "nativeSampleCount": 5750,
      "minimumNativeSampleCount": 4311,
      "internalSampleCount": 5250,
      "minimumInternalSampleCount": 4320,
      "invalidInternalSampleCount": 0,
      "invalidExternalSampleCount": 0,
      "rssGrowthKiB": 127008,
      "rssSlopeKiBPerMinute": 431.46,
      "maxRssKiB": 267328,
      "handleGrowth": 2,
      "maxHandles": 12,
      "threadBaseline": 4,
      "maxThreads": 4,
      "maxCpuPercent": 185.4,
      "scanPasses": 1293,
      "generatedEvents": 32851,
      "watcherBatches": 32851,
      "thumbnailRequests": 47352,
      "hashRequests": 47352,
      "cacheEntries": 20000,
      "scheduler": {
        "mode": "foreground",
        "activeTotal": 1,
        "waitingTotal": 0,
        "peakActiveTotal": 2,
        "peakWaitingTotal": 0,
        "foregroundLimit": 8,
        "backgroundLimit": 4,
        "maxWaiters": 256,
        "scan": {
          "active": 1,
          "waiting": 0,
          "peakActive": 1,
          "peakWaiting": 0,
          "completed": 2023025,
          "rejected": 0,
          "timedOut": 0,
          "cancelled": 0
        },
        "hash": {
          "active": 0,
          "waiting": 0,
          "peakActive": 1,
          "peakWaiting": 0,
          "completed": 47352,
          "rejected": 0,
          "timedOut": 0,
          "cancelled": 0
        },
        "decode": {
          "active": 0,
          "waiting": 0,
          "peakActive": 1,
          "peakWaiting": 0,
          "completed": 47352,
          "rejected": 0,
          "timedOut": 0,
          "cancelled": 0
        }
      }
    }
  },
  "p2A12": {
    "accepted": true,
    "matrixArtifactName": "p2-a12-matrix-9ddfa4e8ada9c2268a3d8acf20c66e188bbd0751-attempt-1",
    "matrixSha256": "1a2cd5d7c0ce58840fb255cdba9f04c139a75c91de2c41dad99be57882fde4f8",
    "hostedRunReceiptSha256": "5850dec51786237b72b5f42f8f8f35a225749878323c19704edba1bce98be6d7",
    "hostedRunVerifiedAt": "2026-08-20T04:44:27Z",
    "gitCommit": "9ddfa4e8ada9c2268a3d8acf20c66e188bbd0751",
    "verifiedAt": "2026-08-20T04:36:50.474Z",
    "githubRunAttempt": "1",
    "runUrl": "https://github.com/BottleFish326/eagle/actions/runs/32332405466",
    "verificationEnvironment": {
      "nodeVersion": "v24.19.0",
      "githubActions": "true",
      "githubSha": "9ddfa4e8ada9c2268a3d8acf20c66e188bbd0751",
      "githubRunId": "32332405466",
      "githubRunAttempt": "1",
      "githubWorkflowRef": "BottleFish326/eagle/.github/workflows/ci.yml@refs/heads/main",
      "githubRepository": "BottleFish326/eagle",
      "githubServerUrl": "https://github.com",
      "runnerOs": "Linux",
      "runnerArch": "X64",
      "runnerEnvironment": "github-hosted"
    },
    "artifacts": [
      {
        "artifactName": "p2-a12-source-macOS-9ddfa4e8ada9c2268a3d8acf20c66e188bbd0751-attempt-1",
        "fileName": "p2-a12-platform-paths.json",
        "sha256": "ec21e70ea71f127bc4a0fabea0516a6adcbbe8c8820b9a252b79ea3ecdcd3ed5",
        "platform": "darwin",
        "accepted": true,
        "startedAt": "2026-08-20T04:35:25.632Z",
        "completedAt": "2026-08-20T04:35:55.870Z",
        "environment": {
          "architecture": "arm64",
          "nodeVersion": "v24.18.0",
          "rustc": "rustc 1.97.1 (8bab26f4f 2026-07-14)\nbinary: rustc\ncommit-hash: 8bab26f4f68e0e26f0bb7960be334d5b520ea452\ncommit-date: 2026-07-14\nhost: aarch64-apple-darwin\nrelease: 1.97.1\nLLVM version: 22.1.6",
          "cargo": "cargo 1.97.1 (c980f4866 2026-06-30)",
          "runnerOs": "macOS",
          "runnerArch": "ARM64",
          "runnerEnvironment": "github-hosted",
          "githubRunId": "32332405466",
          "githubRunAttempt": "1",
          "githubWorkflowRef": "BottleFish326/eagle/.github/workflows/ci.yml@refs/heads/main",
          "githubRepository": "BottleFish326/eagle",
          "githubServerUrl": "https://github.com"
        },
        "expectedTests": [
          "library::tests::p2_platform_rejects_configuration_that_enables_symlink_traversal",
          "library::tests::p2_platform_rejects_duplicate_and_overlapping_roots",
          "platform::tests::p2_platform_linux_keys_preserve_case_and_unicode_spelling",
          "platform::tests::p2_platform_macos_normalizes_unicode_without_assuming_volume_case_mode",
          "platform::tests::p2_platform_windows_keys_are_case_insensitive_and_unicode_normalized",
          "platform::tests::p2_platform_windows_portability_diagnostics_cover_names_characters_and_length",
          "scanner::tests::p2_platform_disconnect_during_scan_is_non_authoritative",
          "scanner::tests::p2_platform_permission_revocation_during_scan_is_non_authoritative",
          "scanner::tests::p2_platform_scans_native_unicode_path_without_rewriting_it",
          "scanner::tests::p2_platform_symlink_loop_is_skipped_once_with_an_explicit_diagnostic"
        ],
        "listedTests": [
          "library::tests::p2_platform_rejects_configuration_that_enables_symlink_traversal",
          "library::tests::p2_platform_rejects_duplicate_and_overlapping_roots",
          "platform::tests::p2_platform_linux_keys_preserve_case_and_unicode_spelling",
          "platform::tests::p2_platform_macos_normalizes_unicode_without_assuming_volume_case_mode",
          "platform::tests::p2_platform_windows_keys_are_case_insensitive_and_unicode_normalized",
          "platform::tests::p2_platform_windows_portability_diagnostics_cover_names_characters_and_length",
          "scanner::tests::p2_platform_disconnect_during_scan_is_non_authoritative",
          "scanner::tests::p2_platform_permission_revocation_during_scan_is_non_authoritative",
          "scanner::tests::p2_platform_scans_native_unicode_path_without_rewriting_it",
          "scanner::tests::p2_platform_symlink_loop_is_skipped_once_with_an_explicit_diagnostic"
        ],
        "executedTests": [
          "library::tests::p2_platform_rejects_configuration_that_enables_symlink_traversal",
          "library::tests::p2_platform_rejects_duplicate_and_overlapping_roots",
          "platform::tests::p2_platform_linux_keys_preserve_case_and_unicode_spelling",
          "platform::tests::p2_platform_macos_normalizes_unicode_without_assuming_volume_case_mode",
          "platform::tests::p2_platform_windows_keys_are_case_insensitive_and_unicode_normalized",
          "platform::tests::p2_platform_windows_portability_diagnostics_cover_names_characters_and_length",
          "scanner::tests::p2_platform_disconnect_during_scan_is_non_authoritative",
          "scanner::tests::p2_platform_permission_revocation_during_scan_is_non_authoritative",
          "scanner::tests::p2_platform_scans_native_unicode_path_without_rewriting_it",
          "scanner::tests::p2_platform_symlink_loop_is_skipped_once_with_an_explicit_diagnostic"
        ],
        "summary": {
          "result": "ok",
          "passed": 10,
          "failed": 0,
          "ignored": 0,
          "measured": 0,
          "filteredOut": 28
        }
      },
      {
        "artifactName": "p2-a12-source-Linux-9ddfa4e8ada9c2268a3d8acf20c66e188bbd0751-attempt-1",
        "fileName": "p2-a12-platform-paths.json",
        "sha256": "90173b13f65ec9bade38db0d6606ba454923c8a500df7119e994889cd732b93e",
        "platform": "linux",
        "accepted": true,
        "startedAt": "2026-08-20T04:35:23.813Z",
        "completedAt": "2026-08-20T04:35:41.221Z",
        "environment": {
          "architecture": "x64",
          "nodeVersion": "v24.19.0",
          "rustc": "rustc 1.97.1 (8bab26f4f 2026-07-14)\nbinary: rustc\ncommit-hash: 8bab26f4f68e0e26f0bb7960be334d5b520ea452\ncommit-date: 2026-07-14\nhost: x86_64-unknown-linux-gnu\nrelease: 1.97.1\nLLVM version: 22.1.6",
          "cargo": "cargo 1.97.1 (c980f4866 2026-06-30)",
          "runnerOs": "Linux",
          "runnerArch": "X64",
          "runnerEnvironment": "github-hosted",
          "githubRunId": "32332405466",
          "githubRunAttempt": "1",
          "githubWorkflowRef": "BottleFish326/eagle/.github/workflows/ci.yml@refs/heads/main",
          "githubRepository": "BottleFish326/eagle",
          "githubServerUrl": "https://github.com"
        },
        "expectedTests": [
          "library::tests::p2_platform_rejects_configuration_that_enables_symlink_traversal",
          "library::tests::p2_platform_rejects_duplicate_and_overlapping_roots",
          "platform::tests::p2_platform_linux_keys_preserve_case_and_unicode_spelling",
          "platform::tests::p2_platform_macos_normalizes_unicode_without_assuming_volume_case_mode",
          "platform::tests::p2_platform_windows_keys_are_case_insensitive_and_unicode_normalized",
          "platform::tests::p2_platform_windows_portability_diagnostics_cover_names_characters_and_length",
          "scanner::tests::p2_platform_disconnect_during_scan_is_non_authoritative",
          "scanner::tests::p2_platform_linux_moved_mount_root_is_non_authoritative",
          "scanner::tests::p2_platform_linux_scans_case_distinct_files_as_separate_assets",
          "scanner::tests::p2_platform_permission_revocation_during_scan_is_non_authoritative",
          "scanner::tests::p2_platform_scans_native_unicode_path_without_rewriting_it",
          "scanner::tests::p2_platform_symlink_loop_is_skipped_once_with_an_explicit_diagnostic"
        ],
        "listedTests": [